{
  "schema_version": 1,
  "worker_id": "worker-01",
  "worker_api_base_url": "https://nas:5001/worker-api",
  "auth": {
    "type": "worker_token",
    "token_file": "../worker.token"
  },
  "workspace_root": "../work",
  "path_base_dir": "\\\\nas\\photo",
  "input_modes": [
    "shared_path"
  ],
  "processors": {
    "face": {
      "path": "../bin/av-imgdata-face-processor",
      "model_root": "../.models/face",
      "model_name": "buffalo_l"
    },
    "image_vips": {
      "enabled": true,
      "path": "../bin/av-imgdata-image-processor"
    }
  },
  "poll_interval_seconds": 2,
  "max_parallel_jobs": 1,
  "log_level": "off"
}
